{
  "version": "1.0",
  "profile_id": "CALLER-C-ASK-ONCE",
  "profile_name": "On Ask Once",
  "identity": {
    "name": "Morgan Reed",
    "age": 31,
    "gender": "Female",
    "pronouns": "she/her",
    "phone_number": "+1-604-555-0333",
    "alt_phone_number": "",
    "home_city": "Vancouver, BC"
  },
  "language": {"primary": "English", "other": []},
  "accessibility": {"hearing": "none", "vision": "none", "mobility": "independent"},
  "emotional_baseline": "Concerned",
  "speech": {"rate": "Moderate", "clarity": "High", "disfluencies": ["um"]},
  "interaction_style": {
    "interrupts_operator": false,
    "waits_for_questions": true,
    "volunteers_key_facts": false,
    "asks_for_confirmation": true
  },
  "instruction_following": {"compliance_level": "High", "stays_on_line": true, "will_meet_responders": true},
  "disclosure_policy": {
    "name": "on_ask_once",
    "callback_number": "on_ask_once",
    "current_location": "on_ask_once",
    "unit_suite_floor": "on_ask_once",
    "relationship_to_incident": "on_ask_once",
    "people_involved": "on_ask_once",
    "hazards_or_weapons": "on_ask_once",
    "sensitive_or_legal_topics": "on_ask_once"
  },
  "memory_reliability": {"omission_rate": "Low", "contradiction_rate": "Low", "precision_level": "High"},
  "opening_style": "Factual one-sentence summary",
  "example_short_answers": {
    "name": "Morgan Reed",
    "callback_number": "+1-604-555-0333",
    "relationship_to_incident": "Neighbor",
    "people_involved": "Two adults"
  }
}
